{
  "scores": {
    "strategic_alignment": 88,
    "distinctiveness": 82,
    "visual_coherence": 85,
    "naming_quality": 86,
    "overall": 85
  },
  "dimension_analysis": {
    "strategic_alignment": {
      "score": 88,
      "rationale": "Brand expression strongly embodies Sage archetype (thoughtful, professional, trustworthy). Name 'Faire' directly reinforces positioning on fairness. Visual system (cool tones + refined typography) aligns with professional trust positioning. Logo handshake + arrow metaphor perfectly expresses partnership + growth promise.",
      "evidence": [
        "Sage Blue color is professional and trustworthy, not trendy",
        "Handshake logo directly expresses partnership",
        "Typography choices (serif headlines, sans body) reflect Sage sophistication",
        "Name 'Faire' evokes fairness, directly addressing white space"
      ]
    },
    "distinctiveness": {
      "score": 82,
      "rationale": "Brand is distinctive vs. competitor set. Upwork owns 'largest marketplace' and uses bright corporate colors. Toptal owns 'premium vetted talent' with premium color palette. Faire owns 'fair partnership + growth' with unique visual approach (cool blue + warm earth tones + handshake logo). However, 'fair' concept may not be fully unique (others could adopt similar language).",
      "vs_competitors": "Logo handshake is more distinctive than Upwork's generic mark. Color palette (Sage Blue + Warm Sand) is more approachable than Toptal's premium cool grays. Name 'Faire' is more distinctive than 'Toptal' but generic enough that competitors could claim similar meaning."
    },
    "visual_coherence": {
      "score": 85,
      "rationale": "All visual elements work together cohesively. Color palette (cool + warm tones) reinforces the positioning. Typography (serif + sans) creates hierarchy and professionalism. Logo uses both primary colors effectively. Design tokens are comprehensive and consistent. Minor issue: warm sand accent is used sparingly; could be integrated more consistently across all touchpoints.",
      "consistency_checks": [
        "Color palette internally consistent: cool blue base, warm earth accents",
        "Typography scale works across all sizes from 12px to 48px",
        "Logo scales properly and maintains coherence at all sizes",
        "Design tokens provide comprehensive coverage",
        "Minor: Warm sand accent could appear in more design token applications (buttons, hover states)"
      ]
    },
    "naming_quality": {
      "score": 86,
      "rationale": "Name 'Faire' is strong. Memorable (2 syllables, easy to pronounce), strategically aligned (evokes fairness and partnership), distinctive vs. competitors (no direct competitor uses 'fair' language), domain available (faire.com), international appeal (French origin adds sophistication). Scoring: 90 on memorability, 95 on strategic alignment, 85 on distinctiveness, 75 on domain availability (premium but available).",
      "name_alignment": "Name perfectly reinforces positioning on 'fair value exchange' and directly addresses the competitive white space. French pronunciation adds sophistication appropriate to Sage archetype."
    }
  },
  "strengths": [
    "Positioning is clear, ownable, and well-executed across all brand elements",
    "Visual system is sophisticated and professional without being cold",
    "Logo concept is simple yet strategically rich (handshake + growth)",
    "Color palette is distinctive and accessible (colorblind-safe)",
    "Typography choices reinforce the Sage archetype effectively",
    "Name 'Faire' is memorable and directly addresses the central white space (fair partnership)",
    "All artifacts work together as a cohesive system"
  ],
  "improvement_areas": [
    "Warm sand accent (secondary color) could be used more consistently in design tokens for visual cohesion",
    "Logo could explore additional visual variations for flexibility across different applications",
    "Brand voice guidelines could be more detailed (currently implicit in creative direction, not explicit)"
  ],
  "iteration_recommendations": "Brand identity passes quality threshold at 85/100. No iteration required. All dimensions score ≥70, with strongest dimensions being naming quality (86) and strategic alignment (88). Suggest minor enhancements post-launch: expand design token applications for secondary color, develop additional logo variations for social media/app contexts, formalize brand voice guidelines into standalone document.",
  "pass_fail": true,
  "confidence": 0.92
}
